,Index,course_title,course_organization,course_Certificate_type,course_rating,course_difficulty,course_students_enrolled
272,502,entrepreneurship launching innovative business,"University of Maryland, College Park",SPECIALIZATION,4.6,Beginner,69k
273,527,epidemics dynamics infectious diseases,The Pennsylvania State University,COURSE,4.8,Mixed,45k
274,570,epidemics pandemics outbreaks,University of Pittsburgh,COURSE,4.7,Mixed,23k
275,426,epidemiology public health,Imperial College London,SPECIALIZATION,4.7,Beginner,6.4k
276,60,epidemiology public health practice,Johns Hopkins University,SPECIALIZATION,4.7,Beginner,31k
277,351,epidemiology basic science public health,The University of North Carolina at Chapel Hill,COURSE,4.6,Mixed,130k
278,708,epigenetic control gene expression,The University of Melbourne,COURSE,4.8,Mixed,35k
279,444,equine welfare management,"University of California, Davis",COURSE,4.8,Beginner,7.2k
280,693,esports,"University of California, Irvine",SPECIALIZATION,4.5,Beginner,1.8k
281,454,essential epidemiologic tools public health practice,Johns Hopkins University,COURSE,4.7,Beginner,14k
282,446,essential google cloud infrastructure core services,Google Cloud,COURSE,4.7,Intermediate,68k
283,347,essential google cloud infrastructure foundation,Google Cloud,COURSE,4.7,Intermediate,83k
284,314,essentials clinical simulations across health professions,The George Washington University,COURSE,4.8,Intermediate,4.1k
285,436,essentials corporate finance,The University of Melbourne,SPECIALIZATION,4.6,Intermediate,54k
286,319,essentials global health,Yale University,COURSE,4.8,Mixed,31k
287,847,estadística probabilidad,Universidad Nacional Autónoma de México,COURSE,4.7,Beginner,27k
288,881,evaluación educativa,Universidad Nacional Autónoma de México,SPECIALIZATION,4.8,Beginner,13k
289,256,everyday excel part 1,University of Colorado Boulder,COURSE,4.8,Beginner,11k
290,278,everyday parenting abcs child rearing,Yale University,COURSE,4.9,Beginner,86k
291,11,excel skills business,Macquarie University,SPECIALIZATION,4.9,Beginner,240k
292,591,excel skills business advanced,Macquarie University,COURSE,4.7,Intermediate,39k
293,92,excel skills business essentials,Macquarie University,COURSE,4.9,Beginner,200k
294,218,excel skills business intermediate,Macquarie University,COURSE,4.9,Intermediate,76k
295,419,excel skills business intermediate ii,Macquarie University,COURSE,4.8,Intermediate,39k
296,38,excel mysql analytic techniques business,Duke University,SPECIALIZATION,4.6,Beginner,490k
297,124,excel vba creative problem solving,University of Colorado Boulder,SPECIALIZATION,4.8,Beginner,56k
298,418,excel vba creative problem solving part 1,University of Colorado Boulder,COURSE,4.8,Beginner,54k
299,137,executive data science,Johns Hopkins University,SPECIALIZATION,4.5,Beginner,170k
300,880,explorando la energía sustentable,Pontificia Universidad Católica de Chile,COURSE,4.8,Beginner,28k
301,99,fashion design,The Museum of Modern Art,COURSE,4.8,Beginner,180k
302,509,feminism social justice,"University of California, Santa Cruz",COURSE,4.8,Beginner,18k
303,442,fintech law policy,Duke University,COURSE,4.8,Beginner,9.7k
304,531,fintech finance industry transformation regulation,The Hong Kong University of Science and Technology,SPECIALIZATION,4.6,Beginner,13k
305,453,fintech foundations payments regulations,University of Pennsylvania,COURSE,4.7,Beginner,12k
306,16,finance quantitative modeling analysts,University of Pennsylvania,SPECIALIZATION,4.5,Beginner,260k
307,257,finance non finance professionals,Rice University,COURSE,4.8,Beginner,69k
308,778,finance non financial managers,Emory University,COURSE,4.4,Intermediate,12k
309,85,financial accounting fundamentals,University of Virginia,COURSE,4.8,Beginner,65k
310,396,financial acumen non financial managers,University of Pennsylvania,COURSE,4.5,Beginner,10k
311,158,financial engineering risk management part,Columbia University,COURSE,4.6,Mixed,100k
312,149,financial management,University of Illinois at Urbana-Champaign,SPECIALIZATION,4.7,Intermediate,76k
313,14,financial markets,Yale University,COURSE,4.8,Beginner,470k
314,259,financial markets investment strategy,Indian School of Business,SPECIALIZATION,4.5,Beginner,60k
315,682,financial reporting,University of Illinois at Urbana-Champaign,SPECIALIZATION,4.8,Intermediate,12k
316,356,financial technology fintech innovations,University of Michigan,SPECIALIZATION,4.7,Beginner,6.5k
317,382,financing investing infrastructure,Università Bocconi,COURSE,4.8,Mixed,24k
318,366,finanzas corporativas,Universidad Nacional Autónoma de México,SPECIALIZATION,4.6,Intermediate,30k
319,552,finanzas personales,Universidad Nacional Autónoma de México,COURSE,4.8,Mixed,310k
320,109,finding purpose meaning life living matters,University of Michigan,COURSE,4.7,Beginner,36k
321,66,fintech foundations applications financial technology,University of Pennsylvania,SPECIALIZATION,4.6,Beginner,20k
322,113,first step korean,Yonsei University,COURSE,4.9,Beginner,400k
323,102,food beverage management,Università Bocconi,COURSE,4.8,Mixed,57k
324,174,forensic accounting fraud examination,West Virginia University,COURSE,4.7,Mixed,42k
325,851,formulación evaluación de proyectos complejos,Universidad de los Andes,COURSE,4.9,Intermediate,4.4k
326,337,foundational finance strategic decision making,University of Michigan,SPECIALIZATION,4.8,Beginner,14k
327,721,foundations business strategy,University of Virginia,COURSE,4.8,Beginner,63k
328,775,foundations everyday leadership,University of Illinois at Urbana-Champaign,COURSE,4.8,Mixed,62k
329,313,foundations global health,Johns Hopkins University,SPECIALIZATION,4.7,Beginner,31k
330,209,foundations management,IESE Business School,SPECIALIZATION,4.8,Beginner,64k
331,569,foundations marketing analytics,Emory University,SPECIALIZATION,4.2,Intermediate,27k
332,32,foundations positive psychology,University of Pennsylvania,SPECIALIZATION,4.8,Beginner,89k
333,521,foundations public health practice,Imperial College London,SPECIALIZATION,4.8,Beginner,3.2k
334,203,data insights google cloud platform,Google Cloud,SPECIALIZATION,4.6,Beginner,26k
335,698,big bang dark energy,The University of Tokyo,COURSE,4.8,Beginner,52k
336,863,front end web development react,The Hong Kong University of Science and Technology,COURSE,4.7,Intermediate,45k
337,501,front end web ui frameworks tools bootstrap 4,The Hong Kong University of Science and Technology,COURSE,4.8,Intermediate,89k
338,108,full stack web multiplatform mobile app development,The Hong Kong University of Science and Technology,SPECIALIZATION,4.7,Intermediate,150k
339,89,full stack web development react,The Hong Kong University of Science and Technology,SPECIALIZATION,4.7,Intermediate,140k
340,790,functional programming principles scala,École Polytechnique Fédérale de Lausanne,COURSE,4.8,Intermediate,170k
341,150,functional programming scala,École Polytechnique Fédérale de Lausanne,SPECIALIZATION,4.7,Intermediate,220k
342,441,fundamental neuroscience neuroimaging,Johns Hopkins University,COURSE,4.6,Beginner,30k
343,295,fundamentals accounting,University of Illinois at Urbana-Champaign,SPECIALIZATION,4.6,Beginner,39k
344,164,fundamentals computing,Rice University,SPECIALIZATION,4.8,Beginner,200k
345,581,fundamentals engineering exam review,Georgia Institute of Technology,COURSE,4.7,Mixed,49k
346,425,fundamentals gis,"University of California, Davis",COURSE,4.8,Beginner,86k
347,162,fundamentals graphic design,California Institute of the Arts,COURSE,4.8,Beginner,290k
348,130,fundamentals immunology,Rice University,SPECIALIZATION,4.7,Intermediate,20k
349,415,fundamentals immunology innate immunity b cell function,Rice University,COURSE,4.7,Intermediate,18k
350,633,fundamentals music theory,The University of Edinburgh,COURSE,4.6,Beginner,180k
351,77,fundamentals project planning management,University of Virginia,COURSE,4.7,Beginner,120k
352,165,fundamentals quantitative modeling,University of Pennsylvania,COURSE,4.6,Mixed,110k
353,475,fundamentals reinforcement learning,University of Alberta,COURSE,4.8,Intermediate,22k
354,520,fundamentals visualization tableau,"University of California, Davis",COURSE,4.5,Beginner,81k
355,742,fundamentos empresariales,University of Pennsylvania,SPECIALIZATION,4.6,Beginner,25k
356,857,fundamentos estratégicos empresariales,Universidad Nacional Autónoma de México,SPECIALIZATION,4.6,Beginner,56k
357,724,fundamentos de excel para negocios,Universidad Austral,COURSE,4.7,Beginner,150k
358,388,fundamentos de finanzas empresariales,Universidad de los Andes,COURSE,4.8,Beginner,110k
359,705,fundamentos de la escritura,Tecnológico de Monterrey,COURSE,4.6,Beginner,47k
360,370,fundraising development,"University of California, Davis",SPECIALIZATION,4.6,Beginner,4.9k
361,145,futures thinking,Institute for the Future,SPECIALIZATION,4.8,Beginner,9.4k
362,115,g suite administration,Google Cloud,SPECIALIZATION,4.7,Beginner,10k
363,286,gis mapping spatial analysis,University of Toronto,SPECIALIZATION,4.8,Beginner,140k
364,206,game design development,Michigan State University,SPECIALIZATION,4.7,Intermediate,100k
365,141,game theory,Stanford University,COURSE,4.6,Beginner,260k
366,268,gamification,University of Pennsylvania,COURSE,4.8,Mixed,110k
367,802,gender sexuality diversity inclusion workplace,University of Pittsburgh,COURSE,4.7,Beginner,14k
368,76,genomic data science,Johns Hopkins University,SPECIALIZATION,4.4,Intermediate,80k
369,79,geographic information systems gis,"University of California, Davis",SPECIALIZATION,4.8,Beginner,97k
370,694,geopolitics europe,Sciences Po,COURSE,4.3,Mixed,19k
371,567,geopolítica gobernanza global riesgos oportunidades,ESADE Business and Law School,COURSE,4.8,Mixed,34k
372,650,gestión de organizaciones efectivas,Pontificia Universidad Católica de Chile,COURSE,4.7,Mixed,47k
373,540,get interactive practical teaching technology,Bloomsbury Learning Exchange,COURSE,4.7,Beginner,14k
374,681,getting started music theory,Michigan State University,COURSE,4.5,Beginner,59k
375,568,getting started aws machine learning,Amazon Web Services,COURSE,4.5,Intermediate,73k
376,734,getting started go,"University of California, Irvine",COURSE,4.6,Intermediate,59k
377,422,getting started google kubernetes engine,Google Cloud,COURSE,4.5,Intermediate,75k
378,411,getting started google sheets,Google Cloud,COURSE,4.6,Beginner,18k
379,538,getting started sas programming,SAS,COURSE,4.9,Beginner,22k
380,192,global diplomacy diplomacy modern world,SOAS University of London,COURSE,4.6,Mixed,79k
381,400,global diplomacy united nations world,SOAS University of London,COURSE,4.7,Beginner,29k
382,643,global energy climate policy,SOAS University of London,COURSE,4.5,Beginner,10k
383,578,global environmental management,Technical University of Denmark (DTU),COURSE,4.6,Intermediate,22k
384,835,global financial markets instruments,Rice University,COURSE,4.6,Mixed,37k
385,761,global financing solutions edhec société générale,EDHEC Business School,COURSE,4.6,Intermediate,3.6k
386,740,global trends business society,University of Pennsylvania,COURSE,4.8,Mixed,7.6k
387,717,globalization economic growth stability,IE Business School,SPECIALIZATION,4.8,Intermediate,44k
388,355,good words writing editing,University of Michigan,SPECIALIZATION,4.6,Beginner,3.8k
389,227,google cloud platform big data machine learning fundamentals,Google Cloud,COURSE,4.6,Intermediate,120k
390,849,google cloud platform fundamentals aws professionals,Google Cloud,COURSE,4.7,Intermediate,36k
391,25,google automation python,Google,PROFESSIONAL CERTIFICATE,4.7,Beginner,93k
392,4,google support,Google,PROFESSIONAL CERTIFICATE,4.8,Beginner,350k
393,385,grammar punctuation,"University of California, Irvine",COURSE,4.7,Mixed,430k
394,513,graphic design elements non designers,University of Colorado Boulder,SPECIALIZATION,4.7,Beginner,10k
395,287,greek roman mythology,University of Pennsylvania,COURSE,4.8,Mixed,260k
396,369,greening economy sustainable cities,Lund University,COURSE,4.6,Beginner,56k
397,757,guitar beginners,Berklee College of Music,COURSE,4.8,Mixed,210k
398,710,gut check exploring microbiome,University of California San Diego,COURSE,4.7,Mixed,62k
399,329,html css javascript web developers,Johns Hopkins University,COURSE,4.8,Mixed,240k
400,231,habilidades gerenciales,Universidad Nacional Autónoma de México,SPECIALIZATION,4.7,Beginner,43k
401,785,hacia una práctica constructivista en el aula,Pontificia Universidad Católica de Chile,COURSE,4.8,Mixed,62k
402,803,hardware description languages fpga design,University of Colorado Boulder,COURSE,4.2,Intermediate,7.4k
403,429,healing arts,University of Florida,COURSE,4.6,Mixed,39k
404,244,health informatics,Johns Hopkins University,SPECIALIZATION,4.5,Beginner,8.1k
405,739,health information literacy data analytics,"University of California, Davis",SPECIALIZATION,4.5,Intermediate,5.4k
406,373,healthcare law,University of Pennsylvania,SPECIALIZATION,4.7,Intermediate,1.7k
407,423,healthcare marketplace,University of Minnesota,SPECIALIZATION,4.4,Beginner,36k
408,596,healthcare organization operations,Rutgers the State University of New Jersey,SPECIALIZATION,4.6,Beginner,5.5k
409,845,high performance collaboration leadership teamwork negotiation,Northwestern University,COURSE,4.8,Mixed,46k
410,700,homeland security cybersecurity,University of Colorado System,SPECIALIZATION,4.7,Beginner,5.5k
411,177,hotel management distribution revenue demand management,ESSEC Business School,SPECIALIZATION,4.6,Beginner,28k
412,554,things work introduction physics,University of Virginia,COURSE,4.8,Intermediate,170k
413,767,create website weekend project centered course,The State University of New York,COURSE,3.3,Mixed,140k
414,609,start business,Michigan State University,SPECIALIZATION,4.1,Beginner,34k
415,52,human resource management hr people managers,University of Minnesota,SPECIALIZATION,4.7,Beginner,98k
416,34,ibm ai engineering,IBM,PROFESSIONAL CERTIFICATE,4.6,Intermediate,140k
417,571,ibm ai enterprise workflow,IBM,SPECIALIZATION,4.4,Advanced,3.5k
418,12,ibm applied ai,IBM,PROFESSIONAL CERTIFICATE,4.6,Beginner,220k
419,408,ibm customer engagement specialist professional certificate,IBM,COURSE,4.8,Beginner,3.3k
420,0,ibm data science,IBM,PROFESSIONAL CERTIFICATE,4.6,Beginner,480k
421,98,fundamentals cybersecurity,IBM,SPECIALIZATION,4.5,Beginner,35k
422,476,security defense digital dark arts,Google,COURSE,4.8,Beginner,62k
423,856,identifying monitoring analyzing risk incident response recovery,(ISC)²,COURSE,4.9,Beginner,1.7k
424,562,implementación del marketing mix,IE Business School,SPECIALIZATION,4.7,Beginner,23k
425,640,implementing rpa cognitive automation analytics,Automation Anywhere,SPECIALIZATION,4.6,Beginner,2.2k
426,36,improve english communication skills,Georgia Institute of Technology,SPECIALIZATION,4.7,Beginner,610k
427,123,improving deep neural networks hyperparameter tuning regularization optimization,deeplearning.ai,COURSE,4.9,Beginner,270k
428,748,improving leadership governance nonprofit organizations,Luther College at the University of Regina,SPECIALIZATION,4.4,Beginner,18k
429,318,studio postwar abstract painting,The Museum of Modern Art,COURSE,4.9,Beginner,79k
430,110,indigenous canada,University of Alberta,COURSE,4.8,Mixed,51k
431,572,industrial iot google cloud platform,Google Cloud,COURSE,4.5,Beginner,34k
432,401,infectious disease modelling,Imperial College London,SPECIALIZATION,5.0,Intermediate,1.6k
433,805,influencer marketing strategy,Rutgers the State University of New Jersey,COURSE,4.4,Intermediate,12k
434,224,influencing storytelling change management governance,Macquarie University,SPECIALIZATION,4.8,Beginner,22k
435,549,information security context introduction,"Royal Holloway, University of London",COURSE,4.6,Beginner,32k
436,537,information visualization,New York University,SPECIALIZATION,4.6,Beginner,10k
437,485,information systems,University of Minnesota,SPECIALIZATION,4.7,Beginner,16k
438,169,initiating planning projects,"University of California, Irvine",COURSE,4.7,Mixed,180k
439,365,innovation management,Erasmus University Rotterdam,COURSE,4.6,Beginner,40k
440,747,innovation design think make break repeat,The University of Sydney,COURSE,4.8,Beginner,10k
441,673,innovation creativity entrepreneurship,University of Illinois at Urbana-Champaign,SPECIALIZATION,4.8,Beginner,25k
442,219,inspirational leadership leading sense,HEC Paris,SPECIALIZATION,4.5,Beginner,72k
443,184,inspired leadership,Case Western Reserve University,SPECIALIZATION,4.7,Intermediate,97k
444,443,inspiring motivating individuals,University of Michigan,COURSE,4.8,Mixed,85k
445,345,instructional design foundations applications,University of Illinois at Urbana-Champaign,COURSE,4.2,Mixed,12k
446,837,instructional methods health professions education,University of Michigan,COURSE,4.6,Intermediate,9.7k
447,171,integrative health medicine,University of Minnesota,SPECIALIZATION,4.8,Beginner,14k
448,120,intellectual property law,University of Pennsylvania,SPECIALIZATION,4.8,Intermediate,8.7k
449,128,interaction design,University of California San Diego,SPECIALIZATION,4.5,Intermediate,150k
450,762,intercultural management,ESCP Business School,COURSE,4.6,Beginner,6.5k
451,451,international business essentials,University of London,SPECIALIZATION,4.5,Intermediate,22k
452,701,international cyber conflicts,The State University of New York,COURSE,4.4,Mixed,25k
453,404,international humanitarian law theory practice,Kalshoven-Gieskes Forum,COURSE,4.8,Beginner,22k
454,579,international law action guide international courts tribunals hague,Universiteit Leiden,COURSE,4.8,Mixed,36k
455,280,international law action arbitration international disputes,Universiteit Leiden,COURSE,4.8,Mixed,19k
456,228,international leadership organizational behavior,Università Bocconi,COURSE,4.8,Mixed,41k
457,615,international marketing cross industry growth,Yonsei University,SPECIALIZATION,4.6,Beginner,26k
458,346,international organizations management,University of Geneva,COURSE,4.8,Beginner,20k
459,447,international security management,Erasmus University Rotterdam,COURSE,4.5,Beginner,2.2k
460,193,international women health human rights,Stanford University,COURSE,4.9,Beginner,35k
461,593,international migrations global issue,Sciences Po,COURSE,4.6,Beginner,11k
462,667,internet connection get online,Cisco,COURSE,4.7,Beginner,36k
463,834,internet giants law economics media platforms,The University of Chicago,COURSE,4.8,Mixed,38k
464,582,interviewing resume writing english,"University of Maryland, College Park",SPECIALIZATION,4.6,Intermediate,66k
465,495,introducción data science programación estadística con r,Universidad Nacional Autónoma de México,COURSE,4.7,Beginner,140k
466,327,introducción la programación en python aprendiendo programar con python,Pontificia Universidad Católica de Chile,COURSE,4.4,Beginner,100k
467,844,introduction aux droits de l homme,University of Geneva,COURSE,4.8,Mixed,46k
468,830,introduction ableton live,Berklee College of Music,COURSE,4.8,Mixed,60k
469,427,introduction artificial intelligence ai,IBM,COURSE,4.7,Beginner,44k
470,862,introduction big data,University of California San Diego,COURSE,4.6,Mixed,160k
471,608,introduction blockchain technologies,INSEAD,COURSE,4.7,Beginner,16k
472,620,introduction breast cancer,Yale University,COURSE,4.9,Mixed,27k
473,713,introduction business analytics communicating data,University of Illinois at Urbana-Champaign,COURSE,4.7,Intermediate,14k
474,664,introduction css3,University of Michigan,COURSE,4.8,Mixed,84k
475,412,introduction calculus,The University of Sydney,COURSE,4.8,Intermediate,53k
476,879,introduction chemistry reactions ratios,Duke University,COURSE,4.8,Beginner,46k
477,421,introduction classical music,Yale University,COURSE,4.9,Mixed,150k
478,594,introduction cloud computing,IBM,COURSE,4.6,Beginner,2.6k
479,780,introduction computer programming,"Goldsmiths, University of London",COURSE,4.3,Beginner,20k
480,254,introduction computer science programming,"Goldsmiths, University of London",SPECIALIZATION,4.3,Beginner,32k
481,336,introduction corporate finance,University of Pennsylvania,COURSE,4.6,Mixed,130k
482,723,introduction cyber attacks,New York University,COURSE,4.7,Beginner,27k
483,183,introduction cyber security,New York University,SPECIALIZATION,4.7,Beginner,32k
484,469,introduction cybersecurity tools cyber attacks,IBM,COURSE,4.5,Beginner,30k
485,548,introduction data analysis using excel,Rice University,COURSE,4.7,Mixed,99k
486,1,introduction data science,IBM,SPECIALIZATION,4.6,Beginner,310k
487,187,introduction data science python,University of Michigan,COURSE,4.5,Intermediate,390k
488,253,introduction dental medicine,University of Pennsylvania,COURSE,4.8,Beginner,25k
489,196,introduction discrete mathematics computer science,National Research University Higher School of Economics,SPECIALIZATION,4.4,Beginner,75k
490,745,introduction electronics,Georgia Institute of Technology,COURSE,4.7,Mixed,110k
491,649,introduction embedded systems software development environments,University of Colorado Boulder,COURSE,4.5,Intermediate,41k
492,628,introduction engineering mechanics,Georgia Institute of Technology,COURSE,4.7,Mixed,150k
493,511,introduction environmental law policy,The University of North Carolina at Chapel Hill,COURSE,4.8,Mixed,34k
494,204,introduction financial accounting,University of Pennsylvania,COURSE,4.7,Mixed,200k
495,377,introduction forensic science,"Nanyang Technological University, Singapore",COURSE,4.9,Mixed,47k
496,850,introduction game development,Michigan State University,COURSE,4.8,Mixed,79k
497,499,introduction genetics evolution,Duke University,COURSE,4.8,Mixed,74k
498,878,introduction genomic technologies,Johns Hopkins University,COURSE,4.6,Mixed,42k
499,307,introduction html5,University of Michigan,COURSE,4.7,Mixed,220k
500,774,introduction imagemaking,California Institute of the Arts,COURSE,4.5,Beginner,54k
501,689,introduction intellectual property,University of Pennsylvania,COURSE,4.8,Beginner,6k
502,417,introduction international criminal law,Case Western Reserve University,COURSE,4.8,Mixed,82k
503,136,introduction marketing,University of Pennsylvania,COURSE,4.8,Mixed,220k
504,340,introduction mathematical thinking,Stanford University,COURSE,4.8,Intermediate,270k
505,533,introduction operations management,University of Pennsylvania,COURSE,4.5,Mixed,87k
506,542,introduction personal branding,University of Virginia,COURSE,4.4,Beginner,140k
507,235,introduction philosophy,The University of Edinburgh,COURSE,4.6,Mixed,370k
508,617,introduction portfolio construction analysis python,EDHEC Business School,COURSE,4.8,Mixed,11k
509,473,introduction probability data,Duke University,COURSE,4.7,Beginner,160k
510,190,introduction programming c,Duke University,SPECIALIZATION,4.7,Beginner,82k
511,308,introduction programming matlab,Vanderbilt University,COURSE,4.8,Beginner,270k
512,29,introduction psychology,Yale University,COURSE,4.9,Beginner,270k
513,293,introduction scripting python,Rice University,SPECIALIZATION,4.7,Beginner,49k
514,729,introduction self driving cars,University of Toronto,COURSE,4.8,Advanced,39k
515,339,introduction spreadsheets models,University of Pennsylvania,COURSE,4.2,Mixed,76k
516,766,introduction statistics data analysis public health,Imperial College London,COURSE,4.7,Beginner,12k
517,312,introduction sustainability,University of Illinois at Urbana-Champaign,COURSE,4.8,Mixed,69k
518,250,introduction systematic review meta analysis,Johns Hopkins University,COURSE,4.8,Mixed,67k
519,758,introduction systems engineering,UNSW Sydney (The University of New South Wales),COURSE,4.7,Mixed,33k
520,230,introduction tensorflow artificial intelligence machine learning deep learning,deeplearning.ai,COURSE,4.7,Intermediate,150k
521,735,introduction thermodynamics transferring energy,University of Michigan,COURSE,4.8,Beginner,4.1k
522,659,introduction trading machine learning gcp,New York Institute of Finance,COURSE,4.0,Intermediate,13k
523,557,introduction typography,California Institute of the Arts,COURSE,4.8,Beginner,72k
524,428,introduction user experience design,Georgia Institute of Technology,COURSE,4.5,Beginner,87k
525,744,introduction user experience principles processes,University of Michigan,COURSE,4.8,Beginner,16k
526,625,introduction web development,"University of California, Davis",COURSE,4.7,Beginner,76k
527,194,introduction biology cancer,Johns Hopkins University,COURSE,4.8,Beginner,110k
528,270,introductory human physiology,Duke University,COURSE,4.7,Mixed,270k
529,741,introdução aos princípios e práticas da gestão de projetos,Universidade de São Paulo,SPECIALIZATION,4.9,Beginner,4.5k
530,866,introdução à ciência da computação com python parte 1,Universidade de São Paulo,COURSE,4.9,Beginner,120k
531,80,investment management,University of Geneva,SPECIALIZATION,4.7,Beginner,99k
532,147,investment management python machine learning,EDHEC Business School,SPECIALIZATION,4.6,Beginner,14k
533,195,investment portfolio management,Rice University,SPECIALIZATION,4.5,Beginner,49k
534,639,japanese beginners 1,Saint Petersburg State University,COURSE,4.6,Beginner,4.4k
535,45,java programming software engineering fundamentals,Duke University,SPECIALIZATION,4.6,Beginner,380k
536,518,java programming solving problems software,Duke University,COURSE,4.6,Beginner,160k
537,586,julia scientific programming,University of Cape Town,COURSE,4.5,Beginner,22k
538,546,kotlin java developers,JetBrains,COURSE,4.7,Intermediate,37k
539,516,l excellence opérationnelle en pratique,ESSEC Business School,COURSE,4.7,Beginner,8k
