,Index,course_title,course_organization,course_Certificate_type,course_rating,course_difficulty,course_students_enrolled
814,524,science training young athletes,University of Florida,COURSE,4.9,Beginner,13k
815,2,science well,Yale University,COURSE,4.9,Mixed,2.5m
816,118,singer songwriter,Berklee College of Music,SPECIALIZATION,4.8,Beginner,320k
817,677,social context mental health illness,University of Toronto,COURSE,4.6,Mixed,19k
818,138,strategy content marketing,"University of California, Davis",COURSE,4.5,Intermediate,100k
819,361,sustainable development goals global transdisciplinary vision future,University of Copenhagen,COURSE,4.8,Beginner,26k
820,459,teacher social emotional learning sel,University of Colorado Boulder,SPECIALIZATION,4.7,Beginner,5.2k
821,666,technology music production,Berklee College of Music,COURSE,4.8,Beginner,28k
822,616,truth cats dogs,The University of Edinburgh,COURSE,4.7,Mixed,33k
823,716,hidden value lean manufacturing services,École des Ponts ParisTech,COURSE,4.7,Beginner,14k
824,584,think understand arguments,Duke University,COURSE,4.6,Beginner,200k
825,146,tools data science,IBM,COURSE,4.6,Beginner,120k
826,220,trading strategies emerging markets,Indian School of Business,SPECIALIZATION,4.3,Beginner,68k
827,529,transmedia storytelling narrative worlds emerging technologies global audiences,UNSW Sydney (The University of New South Wales),COURSE,4.8,Mixed,45k
828,530,tricky american english pronunciation,"University of California, Irvine",COURSE,4.7,Beginner,110k
829,438,troubles du spectre de l autisme diagnostic,University of Geneva,COURSE,4.9,Intermediate,5.4k
830,245,u federal taxation,University of Illinois at Urbana-Champaign,SPECIALIZATION,4.8,Intermediate,12k
831,153,uci project management,"University of California, Irvine",PROFESSIONAL CERTIFICATE,4.6,Beginner,44k
832,46,ui ux design,California Institute of the Arts,SPECIALIZATION,4.7,Beginner,68k
833,595,ux design fundamentals,California Institute of the Arts,COURSE,4.8,Beginner,25k
834,676,understanding cancer metastasis,Johns Hopkins University,COURSE,4.8,Beginner,29k
835,353,understanding clinical research behind statistics,University of Cape Town,COURSE,4.8,Mixed,78k
836,500,understanding einstein special theory relativity,Stanford University,COURSE,4.9,Beginner,89k
837,173,understanding medical research facebook friend wrong,Yale University,COURSE,4.8,Beginner,24k
838,886,understanding modern finance,American Institute of Business and Economics,SPECIALIZATION,4.4,Intermediate,11k
839,746,understanding plants part plant knows,Tel Aviv University,COURSE,4.8,Beginner,49k
840,261,understanding research methods,SOAS University of London,COURSE,4.5,Mixed,120k
841,465,understanding visualizing data python,University of Michigan,COURSE,4.7,Beginner,30k
842,249,understanding brain neurobiology everyday life,The University of Chicago,COURSE,4.9,Beginner,130k
843,865,unity certified programmer exam preparation,Unity,SPECIALIZATION,4.5,Intermediate,6.1k
844,618,unity xr build ar vr apps,Unity,SPECIALIZATION,4.2,Beginner,12k
845,882,university teaching,The University of Hong Kong,COURSE,4.8,Beginner,9.5k
846,638,unraveling cycling city,University of Amsterdam,COURSE,4.9,Intermediate,3.9k
847,117,user experience research design,University of Michigan,SPECIALIZATION,4.8,Beginner,23k
848,614,user interface design,University of Minnesota,SPECIALIZATION,4.6,Intermediate,43k
849,350,using databases python,University of Michigan,COURSE,4.8,Mixed,220k
850,199,using python access web data,University of Michigan,COURSE,4.8,Mixed,310k
851,603,using python interact operating system,Google,COURSE,4.7,Beginner,19k
852,262,value chain management,University of Illinois at Urbana-Champaign,SPECIALIZATION,4.7,Intermediate,63k
853,589,version control git,Atlassian,COURSE,4.8,Mixed,40k
854,71,viral marketing craft contagious content,University of Pennsylvania,COURSE,4.7,Mixed,150k
855,407,virtual reality,"Goldsmiths, University of London",SPECIALIZATION,4.7,Beginner,37k
856,297,virtual teacher,"University of California, Irvine",SPECIALIZATION,4.3,Beginner,23k
857,185,vital signs understanding body telling us,University of Pennsylvania,COURSE,4.8,Mixed,190k
858,182,web applications everybody,University of Michigan,SPECIALIZATION,4.8,Intermediate,120k
859,42,web design everybody basics web development coding,University of Michigan,SPECIALIZATION,4.7,Beginner,280k
860,354,weight management beyond balancing calories,Emory University,COURSE,4.7,Beginner,34k
861,144,contemporary art,The Museum of Modern Art,COURSE,4.7,Beginner,120k
862,829,future education,UCL Institute of Education,COURSE,4.7,Mixed,35k
863,543,compliance,University of Pennsylvania,COURSE,4.8,Mixed,6.2k
864,88,data science,IBM,COURSE,4.7,Beginner,260k
865,379,social,Northwestern University,COURSE,4.6,Mixed,94k
866,232,wine tasting sensory techniques wine analysis,"University of California, Davis",COURSE,4.7,Beginner,32k
867,787,wonders ancient egypt,University of Pennsylvania,COURSE,4.8,Intermediate,17k
868,619,write feature length screenplay film television,Michigan State University,COURSE,4.9,Beginner,12k
869,213,write professional emails english,Georgia Institute of Technology,COURSE,4.7,Mixed,270k
870,684,write first novel,Michigan State University,COURSE,4.4,Beginner,18k
871,69,writing sciences,Stanford University,COURSE,4.9,Beginner,140k
872,359,e learning ecologies innovative approaches teaching learning digital age,University of Illinois at Urbana-Champaign,COURSE,4.5,Mixed,17k
873,779,ios app development swift,University of Toronto,SPECIALIZATION,3.9,Intermediate,76k
874,858,qué hacen los buenos directivos prioridades de la alta dirección,IESE Business School,COURSE,4.7,Beginner,25k
875,191,étudier en france french intermediate course b1 b2,École Polytechnique,COURSE,4.8,Intermediate,190k
876,607,éxito profesional,"University of California, Irvine",SPECIALIZATION,4.5,Beginner,69k
877,492,искусство ведения бизнеса,Saint Petersburg State University,SPECIALIZATION,4.6,Beginner,14k
878,156,искусство разработки на современном c,E-Learning Development Fund,SPECIALIZATION,4.9,Intermediate,68k
879,722,корпоративные финансы и стоимость компании,National Research University Higher School of Economics,SPECIALIZATION,4.5,Beginner,16k
880,811,математика и python для анализа данных,E-Learning Development Fund,COURSE,4.8,Beginner,67k
881,132,машинное обучение и анализ данных,E-Learning Development Fund,SPECIALIZATION,4.7,Intermediate,77k
882,405,основы digital маркетинга,National Research University Higher School of Economics,SPECIALIZATION,4.5,Intermediate,19k
883,703,основы программирования на python,National Research University Higher School of Economics,COURSE,4.6,Beginner,83k
884,841,основы разработки на c белый пояс,E-Learning Development Fund,COURSE,4.9,Intermediate,41k
885,889,погружение в python,Moscow Institute of Physics and Technology,COURSE,4.7,Intermediate,45k
886,236,программирование на python,Mail.Ru Group,SPECIALIZATION,4.5,Intermediate,52k
887,883,психолингвистика psycholinguistics,Saint Petersburg State University,COURSE,4.8,Mixed,21k
888,545,разработка интерфейсов вёрстка и javascript,E-Learning Development Fund,SPECIALIZATION,4.5,Intermediate,30k
889,875,русский как иностранный,Saint Petersburg State University,SPECIALIZATION,4.6,Intermediate,9.8k
890,163,финансовые инструменты для частного инвестора,National Research University Higher School of Economics,SPECIALIZATION,4.7,Beginner,38k
